{"artifact_id":"b73f74b82f33834c386134e1f5cd548d9ba304d2d299507d827c4fe7acad412b","commits":[{"action":null,"id":"8fe98ca0d601131cf24256386c096534a24a907ef63352bbb33db0caf224f044","parent":null,"snapshot":{"finished":null,"frames":[{"graph":{"graph":"journey","package":"main"},"instance":1,"locals":{},"node":"station","parameters":{}}],"next_instance":2,"shared":{"helped":false,"letter":false,"rations":3,"rests":0}}},{"action":"camp","id":"9810337436253406875c1436decc857c341ad5103907bd4e85d53515870a4dba","parent":"8fe98ca0d601131cf24256386c096534a24a907ef63352bbb33db0caf224f044","snapshot":{"finished":null,"frames":[{"graph":{"graph":"journey","package":"main"},"instance":1,"locals":{},"node":"camp","parameters":{}},{"graph":{"graph":"visit","package":"camp"},"instance":2,"locals":{"greetings":1},"node":"fire","parameters":{"visitor":"你"}}],"next_instance":3,"shared":{"helped":false,"letter":false,"rations":3,"rests":0}}},{"action":"letter","id":"ebb1b7678a8c48645ca0f74f49d7884884e9594af5a3317a5003d82e80de45af","parent":"9810337436253406875c1436decc857c341ad5103907bd4e85d53515870a4dba","snapshot":{"finished":null,"frames":[{"graph":{"graph":"journey","package":"main"},"instance":1,"locals":{},"node":"camp","parameters":{}},{"graph":{"graph":"visit","package":"camp"},"instance":2,"locals":{"greetings":1},"node":"letter","parameters":{"visitor":"你"}}],"next_instance":3,"shared":{"helped":false,"letter":true,"rations":3,"rests":0}}},{"action":"continue","id":"ea3ab0950c0beb0c7cd819c709264d99ab0881b90aef811b454d0122b28e2dd5","parent":"ebb1b7678a8c48645ca0f74f49d7884884e9594af5a3317a5003d82e80de45af","snapshot":{"finished":null,"frames":[{"graph":{"graph":"journey","package":"main"},"instance":1,"locals":{},"node":"camp","parameters":{}},{"graph":{"graph":"visit","package":"camp"},"instance":2,"locals":{"greetings":1},"node":"fire","parameters":{"visitor":"你"}}],"next_instance":3,"shared":{"helped":false,"letter":true,"rations":3,"rests":0}}},{"action":"rest","id":"8252f3de73c1cf777803d90ac47810aef121c6e47430cbb2f32230cf454899b7","parent":"ea3ab0950c0beb0c7cd819c709264d99ab0881b90aef811b454d0122b28e2dd5","snapshot":{"finished":null,"frames":[{"graph":{"graph":"journey","package":"main"},"instance":1,"locals":{},"node":"camp","parameters":{}},{"graph":{"graph":"visit","package":"camp"},"instance":2,"locals":{"greetings":1},"node":"rest","parameters":{"visitor":"你"}}],"next_instance":3,"shared":{"helped":false,"letter":true,"rations":2,"rests":1}}},{"action":"continue","id":"8ca005e49cdb5b43cfc810befd1cea20c9467adfb70cc15f26e0abe83aeb57f9","parent":"8252f3de73c1cf777803d90ac47810aef121c6e47430cbb2f32230cf454899b7","snapshot":{"finished":null,"frames":[{"graph":{"graph":"journey","package":"main"},"instance":1,"locals":{},"node":"station","parameters":{}}],"next_instance":3,"shared":{"helped":false,"letter":true,"rations":2,"rests":1}}},{"action":"road","id":"4cac57a6e02f7e20bbc9fc8462ca850824784cb815ebdce916510afe8dda7cf3","parent":"8ca005e49cdb5b43cfc810befd1cea20c9467adfb70cc15f26e0abe83aeb57f9","snapshot":{"finished":null,"frames":[{"graph":{"graph":"journey","package":"main"},"instance":1,"locals":{},"node":"road","parameters":{}},{"graph":{"graph":"crossing","package":"road"},"instance":3,"locals":{},"node":"rocks","parameters":{}}],"next_instance":4,"shared":{"helped":false,"letter":true,"rations":2,"rests":1}}},{"action":"help","id":"46a6cd65ce1ca36b4712dd5abf09998b72cd305e69b132c6ce149481258a5836","parent":"4cac57a6e02f7e20bbc9fc8462ca850824784cb815ebdce916510afe8dda7cf3","snapshot":{"finished":null,"frames":[{"graph":{"graph":"journey","package":"main"},"instance":1,"locals":{},"node":"road","parameters":{}},{"graph":{"graph":"crossing","package":"road"},"instance":3,"locals":{},"node":"trail","parameters":{}}],"next_instance":4,"shared":{"helped":true,"letter":true,"rations":1,"rests":1}}},{"action":"continue","id":"95f4570cc54d5c48ddbdbb04f6fd233187bde270e27a6d6f493df865957f4e20","parent":"46a6cd65ce1ca36b4712dd5abf09998b72cd305e69b132c6ce149481258a5836","snapshot":{"finished":null,"frames":[{"graph":{"graph":"journey","package":"main"},"instance":1,"locals":{},"node":"gate","parameters":{}}],"next_instance":4,"shared":{"helped":true,"letter":true,"rations":1,"rests":1}}},{"action":"deliver","id":"806c06f5b277cc3e3dd35711ef62f5743e6e1c1501ac6930f9debcc1665ab98d","parent":"95f4570cc54d5c48ddbdbb04f6fd233187bde270e27a6d6f493df865957f4e20","snapshot":{"finished":[{"graph":"journey","node":"delivered","package":"main"},1,"delivered"],"frames":[],"next_instance":4,"shared":{"helped":true,"letter":true,"rations":1,"rests":1}}}],"cursor":"806c06f5b277cc3e3dd35711ef62f5743e6e1c1501ac6930f9debcc1665ab98d","format_version":1}